{
  "schemaVersion": 1,
  "id": "aws-001",
  "chapterId": "chapter-01",
  "order": 1,
  "playable": true,
  "title": {
    "zh": "第一座云端基地",
    "ja": "最初のクラウド基地",
    "en": "First cloud base"
  },
  "story": {
    "zh": "2035 年，Commander Nova：Shadow Fault 正在破坏云城。第一座云端基地，由你负责。",
    "ja": "2035年、Nova：Shadow Fault が都市を攻撃中。任務：最初のクラウド基地。",
    "en": "2035. Commander Nova: Shadow Fault has attacked the city. Your mission: First cloud base."
  },
  "lesson": {
    "zh": "Region 是地理区域。AZ 是独立故障域；在两个 AZ 部署可降低单点故障风险。",
    "ja": "リージョンは地理的領域、AZ は独立した障害領域です。2 AZ で単一障害点を減らします。",
    "en": "Regions are geographic areas. AZs are independent failure domains; two AZs reduce single points of failure."
  },
  "services": [
    "IAM"
  ],
  "initialResources": [
    {
      "id": "commander",
      "type": "user",
      "region": "ap-northeast-1",
      "attrs": {},
      "policies": [
        {
          "effect": "Allow",
          "actions": [
            "*"
          ],
          "resources": [
            "*"
          ]
        }
      ]
    },
    {
      "id": "vpc-main",
      "type": "vpc",
      "region": "ap-northeast-1",
      "attrs": {
        "cidr": "10.0.0.0/16"
      },
      "policies": []
    },
    {
      "id": "subnet-a",
      "type": "subnet",
      "region": "ap-northeast-1",
      "attrs": {
        "vpc": "vpc-main",
        "cidr": "10.0.1.0/24",
        "az": "ap-northeast-1a"
      },
      "policies": []
    },
    {
      "id": "sg-web",
      "type": "sg",
      "region": "ap-northeast-1",
      "attrs": {
        "port": "443"
      },
      "policies": []
    },
    {
      "id": "ami-base",
      "type": "image",
      "region": "ap-northeast-1",
      "attrs": {
        "app": "running"
      },
      "policies": []
    },
    {
      "id": "base-a",
      "type": "base",
      "region": "ap-northeast-1",
      "attrs": {
        "az": "us-east-1a"
      },
      "policies": []
    }
  ],
  "faults": [
    "fault-001"
  ],
  "objectives": [
    {
      "kind": "region",
      "resource": "base-a",
      "value": "ap-northeast-1"
    },
    {
      "kind": "attribute",
      "resource": "base-a",
      "key": "az",
      "value": "ap-northeast-1a"
    },
    {
      "kind": "attribute",
      "resource": "base-c",
      "key": "az",
      "value": "ap-northeast-1c"
    }
  ],
  "constraints": [],
  "allowedActions": [
    "create",
    "policy",
    "mfa",
    "trust",
    "attachRole",
    "region",
    "start",
    "stop",
    "reboot",
    "terminate",
    "resizeVolume",
    "growFilesystem",
    "attachVolume",
    "image",
    "resizeInstance",
    "service",
    "delete",
    "position"
  ],
  "hints": [
    {
      "zh": "Mira：检查目标资源的状态与权限。",
      "ja": "Mira：対象の状態と権限を確認。",
      "en": "Mira: Inspect target state and permissions."
    },
    {
      "zh": "Region 是地理区域。AZ 是独立故障域；在两个 AZ 部署可降低单点故障风险。",
      "ja": "リージョンは地理的領域、AZ は独立した障害領域です。2 AZ で単一障害点を減らします。",
      "en": "Regions are geographic areas. AZs are independent failure domains; two AZs reduce single points of failure."
    },
    {
      "zh": "Mira：在操作面板选择目标和命令，参考学习总结中的原理。",
      "ja": "Mira：操作パネルで対象とコマンドを選択。",
      "en": "Mira: Select the target and command in the action panel."
    }
  ],
  "reference": [
    {
      "op": "delete",
      "id": "base-a",
      "args": {},
      "policies": []
    },
    {
      "op": "region",
      "id": "",
      "args": {
        "value": "ap-northeast-1"
      },
      "policies": []
    },
    {
      "op": "create",
      "id": "base-a",
      "args": {
        "type": "base",
        "az": "ap-northeast-1a"
      },
      "policies": []
    },
    {
      "op": "create",
      "id": "base-c",
      "args": {
        "type": "base",
        "az": "ap-northeast-1c"
      },
      "policies": []
    }
  ],
  "xp": 150,
  "coins": 50
}