{
  "schemaVersion": 1,
  "id": "aws-012",
  "chapterId": "chapter-02",
  "order": 12,
  "playable": true,
  "title": {
    "zh": "午夜故障",
    "ja": "真夜中の障害",
    "en": "Midnight outage"
  },
  "story": {
    "zh": "2035 年，Commander Nova：Shadow Fault 正在破坏云城。午夜故障，由你负责。",
    "ja": "2035年、Nova：Shadow Fault が都市を攻撃中。任務：真夜中の障害。",
    "en": "2035. Commander Nova: Shadow Fault has attacked the city. Your mission: Midnight outage."
  },
  "lesson": {
    "zh": "实例运行不代表应用运行。查看指标与 app 状态，恢复应用服务。",
    "ja": "インスタンス稼働はアプリ稼働を意味しません。メトリクスと app 状態を確認します。",
    "en": "A running instance does not imply a running application. Inspect metrics and app state."
  },
  "services": [
    "EC2",
    "IAM",
    "CloudWatch"
  ],
  "initialResources": [
    {
      "id": "commander",
      "type": "user",
      "region": "ap-northeast-1",
      "attrs": {},
      "policies": [
        {
          "effect": "Allow",
          "actions": [
            "*"
          ],
          "resources": [
            "*"
          ]
        }
      ]
    },
    {
      "id": "vpc-main",
      "type": "vpc",
      "region": "ap-northeast-1",
      "attrs": {
        "cidr": "10.0.0.0/16"
      },
      "policies": []
    },
    {
      "id": "subnet-a",
      "type": "subnet",
      "region": "ap-northeast-1",
      "attrs": {
        "vpc": "vpc-main",
        "cidr": "10.0.1.0/24",
        "az": "ap-northeast-1a"
      },
      "policies": []
    },
    {
      "id": "sg-web",
      "type": "sg",
      "region": "ap-northeast-1",
      "attrs": {
        "port": "443"
      },
      "policies": []
    },
    {
      "id": "ami-base",
      "type": "image",
      "region": "ap-northeast-1",
      "attrs": {
        "app": "running"
      },
      "policies": []
    },
    {
      "id": "i-web",
      "type": "instance",
      "region": "ap-northeast-1",
      "attrs": {
        "state": "running",
        "app": "stopped",
        "system": "ok",
        "instanceType": "t3.micro",
        "az": "ap-northeast-1a",
        "ami": "ami-base",
        "subnet": "subnet-a",
        "sg": "sg-web",
        "cpu": "2",
        "memory": "25"
      },
      "policies": []
    }
  ],
  "faults": [
    "fault-012"
  ],
  "objectives": [
    {
      "kind": "healthy",
      "resource": "i-web"
    }
  ],
  "constraints": [],
  "allowedActions": [
    "create",
    "policy",
    "mfa",
    "trust",
    "attachRole",
    "region",
    "start",
    "stop",
    "reboot",
    "terminate",
    "resizeVolume",
    "growFilesystem",
    "attachVolume",
    "image",
    "resizeInstance",
    "service",
    "delete",
    "position"
  ],
  "hints": [
    {
      "zh": "Mira：检查目标资源的状态与权限。",
      "ja": "Mira：対象の状態と権限を確認。",
      "en": "Mira: Inspect target state and permissions."
    },
    {
      "zh": "实例运行不代表应用运行。查看指标与 app 状态，恢复应用服务。",
      "ja": "インスタンス稼働はアプリ稼働を意味しません。メトリクスと app 状態を確認します。",
      "en": "A running instance does not imply a running application. Inspect metrics and app state."
    },
    {
      "zh": "Mira：在操作面板选择目标和命令，参考学习总结中的原理。",
      "ja": "Mira：操作パネルで対象とコマンドを選択。",
      "en": "Mira: Select the target and command in the action panel."
    }
  ],
  "reference": [
    {
      "op": "service",
      "id": "i-web",
      "args": {
        "app": "running"
      },
      "policies": []
    }
  ],
  "xp": 150,
  "coins": 50
}