{
  "schemaVersion": 1,
  "id": "aws-003",
  "chapterId": "chapter-01",
  "order": 3,
  "playable": true,
  "title": {
    "zh": "过大的权限",
    "ja": "過剰な権限",
    "en": "Excessive permissions"
  },
  "story": {
    "zh": "2035 年，Commander Nova：Shadow Fault 正在破坏云城。过大的权限，由你负责。",
    "ja": "2035年、Nova：Shadow Fault が都市を攻撃中。任務：過剰な権限。",
    "en": "2035. Commander Nova: Shadow Fault has attacked the city. Your mission: Excessive permissions."
  },
  "lesson": {
    "zh": "移除通配符权限，同时保留读取 rescue 对象的权限。",
    "ja": "ワイルドカード権限を除去し、rescue オブジェクトの読取を維持します。",
    "en": "Remove wildcard grants while retaining reads of rescue objects."
  },
  "services": [
    "IAM"
  ],
  "initialResources": [
    {
      "id": "commander",
      "type": "user",
      "region": "ap-northeast-1",
      "attrs": {},
      "policies": [
        {
          "effect": "Allow",
          "actions": [
            "*"
          ],
          "resources": [
            "*"
          ]
        }
      ]
    },
    {
      "id": "vpc-main",
      "type": "vpc",
      "region": "ap-northeast-1",
      "attrs": {
        "cidr": "10.0.0.0/16"
      },
      "policies": []
    },
    {
      "id": "subnet-a",
      "type": "subnet",
      "region": "ap-northeast-1",
      "attrs": {
        "vpc": "vpc-main",
        "cidr": "10.0.1.0/24",
        "az": "ap-northeast-1a"
      },
      "policies": []
    },
    {
      "id": "sg-web",
      "type": "sg",
      "region": "ap-northeast-1",
      "attrs": {
        "port": "443"
      },
      "policies": []
    },
    {
      "id": "ami-base",
      "type": "image",
      "region": "ap-northeast-1",
      "attrs": {
        "app": "running"
      },
      "policies": []
    },
    {
      "id": "operator",
      "type": "user",
      "region": "ap-northeast-1",
      "attrs": {},
      "policies": [
        {
          "effect": "Allow",
          "actions": [
            "*"
          ],
          "resources": [
            "*"
          ]
        }
      ]
    }
  ],
  "faults": [
    "fault-003"
  ],
  "objectives": [
    {
      "kind": "leastPrivilege",
      "resource": "operator",
      "action": "s3:GetObject",
      "target": "arn:aws:s3:::rescue/*"
    }
  ],
  "constraints": [],
  "allowedActions": [
    "create",
    "policy",
    "mfa",
    "trust",
    "attachRole",
    "region",
    "start",
    "stop",
    "reboot",
    "terminate",
    "resizeVolume",
    "growFilesystem",
    "attachVolume",
    "image",
    "resizeInstance",
    "service",
    "delete",
    "position"
  ],
  "hints": [
    {
      "zh": "Mira：检查目标资源的状态与权限。",
      "ja": "Mira：対象の状態と権限を確認。",
      "en": "Mira: Inspect target state and permissions."
    },
    {
      "zh": "移除通配符权限，同时保留读取 rescue 对象的权限。",
      "ja": "ワイルドカード権限を除去し、rescue オブジェクトの読取を維持します。",
      "en": "Remove wildcard grants while retaining reads of rescue objects."
    },
    {
      "zh": "Mira：在操作面板选择目标和命令，参考学习总结中的原理。",
      "ja": "Mira：操作パネルで対象とコマンドを選択。",
      "en": "Mira: Select the target and command in the action panel."
    }
  ],
  "reference": [
    {
      "op": "policy",
      "id": "operator",
      "args": {},
      "policies": [
        {
          "effect": "Allow",
          "actions": [
            "s3:GetObject"
          ],
          "resources": [
            "arn:aws:s3:::rescue/*"
          ]
        }
      ]
    }
  ],
  "xp": 150,
  "coins": 50
}