{
  "schemaVersion": 1,
  "id": "aws-005",
  "chapterId": "chapter-01",
  "order": 5,
  "playable": true,
  "title": {
    "zh": "身份危机",
    "ja": "認証の危機",
    "en": "Identity crisis"
  },
  "story": {
    "zh": "2035 年，Commander Nova：Shadow Fault 正在破坏云城。身份危机，由你负责。",
    "ja": "2035年、Nova：Shadow Fault が都市を攻撃中。任務：認証の危機。",
    "en": "2035. Commander Nova: Shadow Fault has attacked the city. Your mission: Identity crisis."
  },
  "lesson": {
    "zh": "MFA 增强身份验证。检查异常登录并启用训练用 MFA。",
    "ja": "MFA は認証を強化します。異常ログインを調べ、訓練用 MFA を有効化します。",
    "en": "MFA strengthens authentication. Inspect anomalous login and enable simulated MFA."
  },
  "services": [
    "IAM"
  ],
  "initialResources": [
    {
      "id": "commander",
      "type": "user",
      "region": "ap-northeast-1",
      "attrs": {},
      "policies": [
        {
          "effect": "Allow",
          "actions": [
            "*"
          ],
          "resources": [
            "*"
          ]
        }
      ]
    },
    {
      "id": "vpc-main",
      "type": "vpc",
      "region": "ap-northeast-1",
      "attrs": {
        "cidr": "10.0.0.0/16"
      },
      "policies": []
    },
    {
      "id": "subnet-a",
      "type": "subnet",
      "region": "ap-northeast-1",
      "attrs": {
        "vpc": "vpc-main",
        "cidr": "10.0.1.0/24",
        "az": "ap-northeast-1a"
      },
      "policies": []
    },
    {
      "id": "sg-web",
      "type": "sg",
      "region": "ap-northeast-1",
      "attrs": {
        "port": "443"
      },
      "policies": []
    },
    {
      "id": "ami-base",
      "type": "image",
      "region": "ap-northeast-1",
      "attrs": {
        "app": "running"
      },
      "policies": []
    },
    {
      "id": "admin-nova",
      "type": "user",
      "region": "ap-northeast-1",
      "attrs": {
        "mfa": "false",
        "loginSecure": "false"
      },
      "policies": []
    }
  ],
  "faults": [
    "fault-005"
  ],
  "objectives": [
    {
      "kind": "attribute",
      "resource": "admin-nova",
      "key": "mfa",
      "value": "true"
    },
    {
      "kind": "attribute",
      "resource": "admin-nova",
      "key": "loginSecure",
      "value": "true"
    }
  ],
  "constraints": [],
  "allowedActions": [
    "create",
    "policy",
    "mfa",
    "trust",
    "attachRole",
    "region",
    "start",
    "stop",
    "reboot",
    "terminate",
    "resizeVolume",
    "growFilesystem",
    "attachVolume",
    "image",
    "resizeInstance",
    "service",
    "delete",
    "position"
  ],
  "hints": [
    {
      "zh": "Mira：检查目标资源的状态与权限。",
      "ja": "Mira：対象の状態と権限を確認。",
      "en": "Mira: Inspect target state and permissions."
    },
    {
      "zh": "MFA 增强身份验证。检查异常登录并启用训练用 MFA。",
      "ja": "MFA は認証を強化します。異常ログインを調べ、訓練用 MFA を有効化します。",
      "en": "MFA strengthens authentication. Inspect anomalous login and enable simulated MFA."
    },
    {
      "zh": "Mira：在操作面板选择目标和命令，参考学习总结中的原理。",
      "ja": "Mira：操作パネルで対象とコマンドを選択。",
      "en": "Mira: Select the target and command in the action panel."
    }
  ],
  "reference": [
    {
      "op": "mfa",
      "id": "admin-nova",
      "args": {},
      "policies": []
    }
  ],
  "xp": 150,
  "coins": 50
}